review_id,review,sentiment_label,sentiment_score,identified_themes
6321,"Excellent and user friendly App. Excellence is what makes you always one step ahead. Dashen Bank, Always One Step Ahead !!",POSITIVE,0.9998682737350464,Other
6322,Proud to be dashen family . Shout out to the serial entrepreneur 👏,POSITIVE,0.9998549222946167,Other
6323,Excellent app.,POSITIVE,0.9998461008071899,Other
6324,First ATM in East africa ⭐️⭐️⭐️⭐️⭐️,POSITIVE,0.9874703288078308,Other
6325,Best app.,POSITIVE,0.999774158000946,Other
6326,Better Move to catch the competition up👍,POSITIVE,0.9914566874504089,Other
6327,"Great job my home, my bank.",POSITIVE,0.9998712539672852,Other
6328,Wow,POSITIVE,0.999592125415802,Other
6329,Always one step ahead! What a masterpiece.,POSITIVE,0.9998708963394165,Other
6330,Great App Well done Dashen Bank,POSITIVE,0.9997735619544983,Other
6331,Great!,POSITIVE,0.9998692274093628,Other
6332,Nice,POSITIVE,0.9998552799224854,Other
6333,"I love it but it has bugs during confirmation of password! So, please make it functional",POSITIVE,0.9805048108100891,Account Access Issues
6334,Always one step forward,POSITIVE,0.999639630317688,Other
6335,"It's great! But it will be advanced if you include a caption that allow customers to transfer to Telebirr account. Dashen Bank, ""ኩሉ ግዜ፡ ሓደ ስጕሚ ቀዳሚ።"" (Always one step ahead!)",POSITIVE,0.9995723366737366,Transaction Performance
6336,Small size with vast features and functionalities.,POSITIVE,0.9981461763381958,Feature Requests
6337,Amazing app 👏 👌 Dashen bank one step a head,POSITIVE,0.9995114803314209,Other
6338,Best app,POSITIVE,0.999686598777771,Other
6339,"It has a great application features from the beginning. I'm glad to use it even I haven't used it yet because I haven't activated my account yet. But it's simple, comprehensive, full of information, and fast. በርቱ ዳሸኖች: The super app has impressed me more than I expected.",POSITIVE,0.999612033367157,Feature Requests
6340,Dashen Bank Always One Step Ahead!,POSITIVE,0.9996882677078247,Other
6341,U can't create account,NEGATIVE,-0.9984429478645325,Other
6342,Really super app... so seamless and with a nice user interface .. we are proud of you dashen bank ...,POSITIVE,0.9998613595962524,User Interface
6343,We will see it,POSITIVE,0.9998630285263062,Other
6344,Always one step a head!,POSITIVE,0.9981322884559631,Other
6345,"A lightweight,catchy and smooth app",POSITIVE,0.9987092018127441,Other
6346,Very impressive interface with best security feature and user friendly app.,POSITIVE,0.9997988343238831,"User Interface, Feature Requests"
6347,It is so far so good it has a unique features than telebirr good job Dashen,POSITIVE,0.9998282194137573,Feature Requests
6348,"Yea , it's a good idea to make it with the bank name, it will help for the bank easily to find the application, and customers can easily downloed and use the product. I wish all the best for Dashen bank initiative.",POSITIVE,0.7550314664840698,Customer Support
6349,This is My Bank!,POSITIVE,0.9968096613883972,Other
6350,Dashen Bank Always One Step Ahead!,POSITIVE,0.9996882677078247,Other
6351,"Truly, db => AlwaysOneStepAhead !!",NEGATIVE,-0.9989049434661865,Other
6352,ALWAYS ONE STEP AHEAD,POSITIVE,0.9997699856758118,Other
6353,Well developed,POSITIVE,0.9998576641082764,Other
6354,oh nice!!! i wish it's very nice app,POSITIVE,0.9996349811553955,Other
6355,Really the app looks like amazing. I can't wait to activate in the morning.,POSITIVE,0.9997010827064514,Other
6356,Applause 👏 Dashen Bank. One of the best super app inorder to pay easily and securely. One step a head.,POSITIVE,0.9996860027313232,Other
6357,Wow Dashen Super App 🚀🚀,POSITIVE,0.9978638291358948,Other
6358,All in One,POSITIVE,0.9988051652908325,Other
6359,The best Banking app I have ever seen,POSITIVE,0.9997634291648865,Other
6360,It looks good and simple to use,POSITIVE,0.9998189806938171,Other
6361,Best,POSITIVE,0.9997941851615906,Other
6362,App That makes Difference!,POSITIVE,0.9998338222503662,Other
6363,Faster and userfriendly,POSITIVE,0.9199286103248596,Other
6364,Best,POSITIVE,0.9997941851615906,Other
6365,"Waw Great and innovated,user friendly, always one step ahead",POSITIVE,0.999778687953949,Other
6366,It's Best waww 🙏,POSITIVE,0.9997444748878479,Other
6367,Always one step ahead,POSITIVE,0.9997699856758118,Other
6368,"Like Me, I Hope It Works Better Than Before.",POSITIVE,0.99872225522995,Other
